<!ELEMENT BOARD (NAME,(ARTICLE+))>
<!ELEMENT NAME (#PCDATA)>
<!ELEMENT ARTICLE (TITLE,MESSAGE,WRITERID,WRITERNAME,(REPLY*))>
<!ELEMENT TITLE (#PCDATA)>
<!ELEMENT MESSAGE (#PCDATA)>
<!ELEMENT WRITERID (#PCDATA)>
<!ELEMENT WRITERNAME (#PCDATA)>
<!ELEMENT REPLY (MESSAGE,WRITERID,WRITERNAME)>